country,id,notam_id,fir,from_utc,to_utc,lat,lon,radius_nm,qcode,raw,polygon
FAA,81533666,B2880/2026,RPHI,2026-06-30T22:00:00Z,2026-09-30T16:00:00Z,15.633333,120.55,011,QWELW,B2880/26 NOTAMN  Q) RPHI/QWELW/IV/BO /W /000/100/1538N12033E011  A) RPHI B) 2606302200 C) 2609301600  D) 2200-1600  E) MIL EXER WILL TAKE PLACE WI:  154122N 1202330E -  154703N 1203704E -  153649N 1204232E -  152804N 1203249E -  154122N 1202330E  (TARLAC).  F) SFC G) 10000FT AMSL,
FAA,81533844,B2882/2026,RPHI,2026-06-30T22:00:00Z,2026-09-30T16:00:00Z,16.166667,119.033333,086,QWELW,B2882/26 NOTAMN  Q) RPHI/QWELW/IV/BO /W /000/600/1610N11902E086  A) RPHI B) 2606302200 C) 2609301600  D) 2200-1600  E) MIL EXER WILL TAKE PLACE WI:  173430.00N 1190026.00E -  170000.00N 1192005.00E -  144712.61N 1192005.00E -  162040.00N 1173450.00E -  173430.00N 1190026.00E  (IMTA-1C).  F) SFC G) FL600,
FAA,81623724,B3089/2026,RPHI,2026-07-02T00:00:00Z,2026-07-27T09:00:00Z,14.583333,121.066667,001,QWELW,"B3089/26 NOTAMN  Q) RPHI/QWELW/IV/BO /W /000/007/1435N12104E001  A) RPHI B) 2607020000 C) 2607270900  D) 0000-0900  E) MIL EXER WILL TAKE PLACE WI:  1KM RADIUS CENTERED ON 143523N 1210410E  (THE MEDICAL CITY HELIPAD, ORTIGAS AVENUE, PASIG CITY).  F) SFC G) 700FT AMSL",
FAA,81757693,B3410/2026,RPHI,2026-07-21T00:00:00Z,2026-07-24T09:00:00Z,15.35,119.5,087,QWELW,B3410/26 NOTAMN  Q) RPHI/QWELW/IV/BO /W /000/220/1521N11930E087  A) RPHI B) 2607210000 C) 2607240900  D) 0000-0900  E) MIL EXER WILL TAKE PLACE WI:  162541.00N 1183154.00E -  162624.00N 1190830.00E -  143813.31N 1191301.67E -  145549.37N 1195909.96E -  141538.45N 1202631.02E -  141255.58N 1191410.32E -  141314.00N 1191337.00E -  162541.00N 1183154.00E  (WEST PHILIPPINE SEA EXCLUDING IMTA-1C).  F) SFC G) FL220,
FAA,53283495,A724/2019,KZMA,2019-04-30T18:30:00Z,,,,,QXXXX,"A0724/19 NOTAMR A0682/19  Q) KZMA/QXXXX//////  A) KZMA  B) 1904301830  C) PERM  E) MAIMI CENTER NO LONGER REQUIRES A 10MIN CALL PRIOR TO XNG  THE MIAMI FIR BOUNDARY EXC FOR NB TFC OVER THE  FOLLOWING LOCATIONS:   NB ACFT FM SANTO DOMINGO FIR OVER SEKAR LERED  POKEGUSE ASIVO USE 126.45. OVER MALVN USE 123.77    NB ACFT FM PORT-AU-PRINCE FIR USE 123.77.     NBD ACFT FM CUBA FIR OVERFLYING DYNAH AT OR ABV FL240 AND ALL ACFT  OVERFLYING ENAMO AND ERRCA USE 127.22. ACFT FM CUBA FIR OVER  GHANN, OVALU OR BYGON USE 123.77.      ALL THESE ACFT SHALL CALL MIAMI /ZMA/ ARTCC 10MIN PRIOR TO XNG THE  MIAMI CTA/FIR BDRY DUE TO HVY AIR TFC CONGESTION.  F) SFC  G) UNL",
FAA,54052207,A1158/2019,KZMA,2019-07-26T13:29:00Z,,,,,QANXX,A1158/19 NOTAMR A1313/15  Q) KZMA/QANXX////270/999/  A) KZMA  B) 1907261329  C) PERM  E) APF/MKY DEPARTURE AIRCRAFT FILING FLIGHT PLANS FOR   DESTINATIONS WEST OF ATL THAT ARE EQUIPPED WITH ADVANCED NAVIGATION   CAPABILITIES REQUESTING AT OR ABOVE FL270 ARE STRONGLY ENCOURAGED TO   FILE DIRECT MOOKY DIRECT HILTI THEN DIRECT POINTS NORTH.  F) FL270  G) UNL,
FAA,79989913,A503/2026,KZMA,2026-03-08T04:00:00Z,2026-09-30T10:00:00Z,,,,QXXXX,"A0503/26 NOTAMN  Q) KZMA/QXXXX/IV/NBO/E/000/999/  A) KZMA  B) 2603080400  C) 2609301000  D) DLY 0400-1000  E) MIAMI/ZMA/ARTCC FLIGHT DATA COMMUNICATIONS SECTION (FDCS) CLSD  DLY 0400-1000. PLEASE CTC 1-800-WX-BRIEF (1-800-992-7423) FOR FPL   PROCESSING. ALL SAR ITEMS (INREQS, ALNOTS, DVFRS) SHOULD BE   DIRECTED TO THE ZMA WATCH DESK TEL 305-716-1588. THE SER OF   PROVIDING COMPUTER IDENTIFICATION NUMBERS (CIDS) WILL   NOT BE AVBL DURING THIS CLOSURE. IF YOU HAVE FPL THAT ARE PROPOSED   BTN 0400Z-1000Z IT IS RECOMMENDED THAT YOU TRANSMIT TO ZMA PRIOR TO   0000 TO AVOID POSSIBLE FPL FILING DLA.  F) SFC  G) UNL",
FAA,34829998,A258/2010,KZNY,2010-03-12T12:53:00Z,,,,,,"A0258/10 NOTAMN A) KZNY PART 1 OF 2 B) 1003121253 C) UFN E)  QXXXX THIS NOTAM REVISES NOTAM A0379/09. NO PROCEDURAL CHANGES   HAVE BEEN MADE. IT HAS BEEN EDITED FOR BREVITY.   WESTBOUND OCEANIC FLIGHT CLEARANCE PROCEDURES.   DUE TO REGIONAL AIR TRAFFIC CONTROL  AUTOMATION SYSTEM COMPATIBLY   PROBLEMS THE FOLLOWING MODIFICATION WERE MADE TO WESTBOUND OCEANIC   FLIGHT CLEARANCE AND RECLEARANCE PROCEDURES IN THE NORTH ATLANTIC   REGION ON MAY 11, 2009. THESE PROCEDURES ARE ONLY APPLIED WITHIN THE   SHANWICK, GANDER, AND NEW YORK AREA CONTROL CENTERS AND CONTINUE IN   FORCE AS FOLLOWS:  AIRCRAFT THAT WILL PROCEED SOUTH OF LATITUDE 39 NORTH AND WEST OF     LONGITUDE 67 WEST WILL BE CLEARED TO THE FIRST NAMED FIX IN THE     NEW YORK OCA THAT IS SPECIFIED IN THE AIRCRAFT'S FILED FLIGHT    PLAN, FOLLOWED BY THE PHRASEOLOGY - VIA FLIGHT PLANNED ROUTE TO     DESTINATION.  AIRCRAFT THAT WILL PROCEED SOUTH OF LATITUDE 20 NORTH AND EAST OF     LONGITUDE 60 WEST  WILL BE CLEARED TO THE LAST SET OF COORDINATES     SPECIFIED IN THE AIRCRAFT'S FILED FLIGHT PLAN PRIOR TO LATITUDE    20 NORTH FOLLOWED BY THE PHRASEOLOGY - VIA FLIGHT PLANNED ROUTE     TO DESTINATION.   END PART 1 OF 2  A0258/10 NOTAMN A) KZNY PART 2 OF 2 B) 1003121253 C) UFN E)  AIRCRAFT THAT HAVE BEEN TAKEN OFF THEIR FLIGHT PLANNED ROUTE WILL     BE RECLEARED TO A FIX SPECIFIED IN THE AIRCRAFT'S FILED FLIGHT     PLAN FOLLOWED BY THE PHRASEOLOGY   VIA FLIGHT PLANNED ROUTE TO     DESTINATION.   IT IS IMPERATIVE THAT OPERATORS FILE FLIGHT PLANS (FPL) AND FLIGHT   PLAN CHANGE (CHG) MESSAGES THROUGH THE NEW YORK OCEANIC CTA/FIR USE   THE ADDRESS KZWYZOZX. IT MUST BE NOTED THAT THE NEW YORK OCEANIC   ADDRESS IS SEPARATE FROM THE NEW YORK DOMESTIC ADDRESS (KZNYZRZX).   OPERATORS MAY FORWARD QUESTIONS TO:     SHANWICK ACC, FINLAY SMITH, ( FINLAY.SMITH@NATS.CO.UK ),     00-44-1292-692663     GANDER ACC, ROBERT FLEMING, ( FLEMINR@NAVCANADA.CA ),     (001)-709-651-5233     NEW YORK ACC, PETER EHRLEIN, ( PETER.C.EHRLEIN@FAA.GOV ),     (001)-631-468-1021  F) SFC  G) UNL  END PART 2 OF 2  ",
FAA,34829999,A346/2011,KZNY,2011-06-30T04:00:00Z,,,,,,"A0346/11 NOTAMR A0345/11   A) KZNY  B) 1106300400  C) UFN  E) QXXXX THREE WAYPOINTS NAMED JISEL, EXXES AND CEETE HAVE BEEN   ESTABLISHED IN WARNING AREA 107.  THEY ARE PUBLISHED, BUT NOT   CHARTED, AND EXIST IN AIRCRAFT S FLIGHT MANAGEMENT SYSTEMS.  DUE TO   THE FACT THAT WARNING AREA AIRSPACE IS NOT ALWAYS AVAILABLE FOR AIR   TRAFFIC CONTROL USE, ROUTING OVER JISEL, EXXES OR CEETE MAY NOT BE   FLIGHT PLANNED BY PILOTS OR OPERATORS.  FOR ADDITIONAL INFORMATION   REGARDING THESE WAYPOINTS, CONTACT CHRIS WINKELEER AT 631-468-1018 OR  VIA E-MAIL AT CHRIS.WINKELEER@FAA.GOV.  THIS NOTAM REPLACES NOTAM   A0791/10  F) SFC  G) UNL",
FAA,34829995,A17/2013,KZNY,2013-02-05T12:00:00Z,,,,,QRACA,"A0017/13 NOTAMN   Q) KZNY/QRACA//////   A) KZNY PART 1 OF 3  B) 1302051200  C) UFN  E) QRACA CHANGE IN NEW YORK CENTER OCEANIC CLEARANCE PROCEDURES  BEGINNING ON 5 FEBRUARY 2013 AT 1200Z, NEW YORK CENTER WILL MODIFY   THE PROCEDURES THAT ARE USED TO ISSUE OCEANIC CLEARANCES TO   EASTBOUND AIRCRAFT ENTERING MINIMUM NAVIGATION PERFORMANCE STANDARD   (MNPS) AIRSPACE. THESE PROCEDURES ONLY APPLY TO AIRCRAFT ENTERING   THE NEW YORK CENTER OCEANIC CTA FROM A FAA FACILITY. THE PURPOSE OF   THIS NOTAM IS TO EXPLAIN THESE CHANGES.  NORTH ATLANTIC (NAT) DOCUMENT 007, TITLED GUIDANCE CONCERNING AIR   NAVIGATION IN AND ABOVE THE NORTH ATLANTIC MNPS AIRSPACE IS A   GUIDANCE DOCUMENT PUBLISHED BY ICAO TO ASSIST USERS IN THE PROPER   PROCEDURES TO BE USED WHEN OPERATING IN THE NAT. CHAPTER 5 OF   DOCUMENT 007, TITLED OCEANIC ATC CLEARANCES, IS THE CHAPTER TO WHICH   THESE CHANGES PERTAIN.  THERE ARE THREE COMPONENTS TO AN OCEANIC CLEARANCE. THEY ARE ROUTE,   END PART 1 OF 3  A0017/13 NOTAMN   Q) KZNY/QRACA//////   A) KZNY PART 2 OF 3  B) 1302051200  C) UFN  E) ALTITUDE AND SPEED. IT IS THE DELIVERY METHOD OF THESE THREE   COMPONENTS WHICH IS CHANGING. BEGINNING ON 5 FEBRUARY 2013, THE FAA   WILL CONSIDER THE AIRPORT CLEARANCE WHICH AN AIRCRAFT RECEIVES ON   THE GROUND AT ITS DEPARTURE AERODROME TO BE THE ROUTE PORTION OF THE   OCEANIC CLEARANCE. ALTITUDE AND SPEED ASSIGNMENT WILL OCCUR PRIOR TO   ENTRY INTO THE NEW YORK CENTER OCEANIC CTA. AS IS THE CURRENT   OPERATING PROCEDURE, UNSOLICITED EN-ROUTE ROUTE, ALTITUDE OR SPEED   CHANGES MAY OCCUR DUE TO CHANGING TRAFFIC SITUATIONS. AT ALL TIMES,   THE LAST ASSIGNED ROUTE, ALTITUDE AND SPEED ARE TO BE MAINTAINED AND   SHOULD BE CONSIDERED YOUR NEW OCEANIC PROFILE. HAVING RECEIVED ALL   THREE COMPONENTS, THE REQUIREMENT TO RECEIVE AN OCEANIC CLEARANCE   WILL HAVE BEEN MET.  FOR EXAMPLE:  AN AIRCRAFT HAS FILED AN FPL FROM MDSD TO EDDF. THIS WOULD TAKE THE   FLIGHT FROM THE SANTO DOMINGO FIR, THROUGH THE MIAMI FIR AND THEN   THE NEW YORK FIR BEFORE ENTERING SANTA MARIA. THE AIRPORT CLEARANCE   END PART 2 OF 3  A0017/13 NOTAMN   Q) KZNY/QRACA//////   A) KZNY PART 3 OF 3  B) 1302051200  C) UFN  E) PROVIDED ON THE GROUND AT MDSD WOULD FULFILL THE ROUTE REQUIREMENT   OF THE OCEANIC CLEARANCE. ONCE AIRBORNE AND IN THE MIAMI FIR, FINAL   SPEED AND ALTITUDE ASSIGNMENT WILL BE GIVEN AFTER THE FLIGHT IS   COORDINATED BETWEEN MIAMI AND NEW YORK.  IF A ROUTE, SPEED OR ALTITUDE CHANGE EN-ROUTE IS DESIRED, THEN   AIRCRAFT SHOULD MAKE A REQUEST FROM THE ATC UNIT IN WHICH THEY ARE   OPERATING. AT ALL TIMES, THE LAST ASSIGNED ROUTE, ALTITUDE AND SPEED   ARE TO BE MAINTAINED.  TRACK MESSAGE IDENTIFICATION NUMBER (TMI) CONFIRMATION FOR AIRCRAFT   FILING AN ABBREVIATED CLEARANCE IN LIEU OF THE TRACK COORDINATES   WILL BE ACCOMPLISHED PRIOR TO REACHING THE TRACK ENTRY POINT.   USERS ARE REMINDED OF THE REQUIREMENT TO FILE AN FPL AND ANY   SUBSEQUENT CHANGES WITH NEW YORK OCEANIC AT KZWYZOZX, ALONG WITH ANY   OTHER ATC FACILITIES THAT MAY REQUIRE SUCH FILING.  F) FL055  G) UNL  END PART 3 OF 3  ",
FAA,81414649,B1216/2026,MMFR,2026-06-10T19:40:00Z,2026-09-15T15:00:00Z,,,,QRDCA,"B1216/26 NOTAMR B1215/26  Q) MMFR/QRDCA/IV/BO/W/000/999/  A) MMFR  B) 2606101940  C) 2609151500  E) THE GOVERNMENT OF THE UNITED STATES OF AMERICA HAS ISSUED AN ADVISORY     REGARDING A POTENTIALLY HAZARDOUS SITUATION WITHIN THE MAZATLAN     OCEANIC (MMFO), MEXICO (MMFR), CENTRAL AMERICA (MHTG),     BOGOTA(SKED),GUAYAQUIL (SEFG), AND PANAMA (MPZL) FLIGHT INFORMATION     REGIONS.          IT IS RECOMMENDED THAT OPERATORS EXERCISE CAUTION WHILE OPERATING IN     THE AREAS OVER THE PACIFIC OCEAN AND THE GULF OF CALIFORNIA WITHIN     THESE FLIGHT INFORMATION REGIONS (FIR) DUE TO MILITARY ACTIVITIES AND     GNSS INTERFERENCE. THERE IS A POTENTIAL RISK TO AIRCRAFT AT ALL     ALTITUDES, INCLUDING OVERFLIGHTS AND THE ARRIVAL AND DEPARTURE PHASES     OF FLIGHT.          AIR NAVIGATION AND AIR TRAFFIC CONTROL SERVICES MAINTAIN THEIR     SURVEILLANCE SYSTEMS (SURVEILLANCE RADAR) AND CONVENTIONAL RADIO     NAVIGATION AIDS (VOR/DME) NATIONWIDE FULLY OPERATIONAL, AS THESE ARE     NOT VULNERABLE TO GNSS INTERFERENCE.  F) SFC  G) UNL",
FAA,81488358,I497/2026,SBAO,2026-08-03T08:30:00Z,2026-09-11T20:19:00Z,-5.933333,-34.85,016,QRRCA,I0497/26 NOTAMN  Q) SBRE/QRRCA/IV/BO/W/000/999/0556S03451W016  A) SBRE  B) 2608030830 C) 2609112019  D) DLY SR-SS  E) SBR 217 (PIRANGI) ACT  F) SFC G) UNL,
FAA,81725911,K835/2026,SBCW,2026-07-20T00:00:00Z,2026-08-20T23:59:00Z,-33.383333,-52.783333,040,QRTCA,K0835/26 NOTAMR K0834/26  Q) SBCW/QRTCA/IV/BO/W/000/999/3323S05247W040  A) SBCW  B) 2607200000 C) 2608202359  E) TEMPORARY RESTRICTED AREA (ARCA1) SUBJ COOR/AUTH ACC CURITIBA WI COORD 333017S0532836W - 325414S0530628W - 332002S0520232W - 335656S0522519W ACT RMK: LDG AND TKOF AD WITHIN THE AREA PPR BEFORE MNM 2HR THRU TEL +55 (41) 3251-5243  F) GND G) UNL,
FAA,81742920,K840/2026,SBCW,2026-07-20T00:00:00Z,2026-08-20T23:59:00Z,-26.9,-53.05,040,QRTCA,"K0840/26 NOTAMN  Q) SBCW/QRTCA/IV/BO/W/000/999/2654S05303W040  A) SBCW  B) 2607200000 C) 2608202359  E) TEMPORARY RESTRICTED AREA (ARCA 13) SUBJ COOR/AUTH CURITIBA ACC AND CHAPECO RDO WI COORD 270731S0534006W - 262857S0533140W - 264025S0522538W - 271924S0523434W - 270731S0534006W ACT  RMK: LDG/TKOF OPS AT AD LOCATED WITHIN THE AREA ARE PPR, WITH A MNM NOTICE OF 2HR, BY TEL +55 (41) 3251-5243.  IMPACTED AWY WILL BE MANAGED BY THE ATS UNITS INVOLVED.  F) GND G) UNL",
FAA,81743522,K843/2026,SBCW,2026-07-20T00:00:00Z,2026-08-20T23:59:00Z,-31.7,-53.3,040,QRTCA,"K0843/26 NOTAMR K0841/26  Q) SBCW/QRTCA/IV/BO/W/000/999/3142S05318W040  A) SBCW  B) 2607200000 C) 2608202359  E) TEMPORARY RESTRICTED AREA (ARCA 3) SUBJ COOR/AUTH ACC CURITIBA AND RDO PELOTAS WI COORD 321614S0532811W - 314607S0535949W - 310722S0530707W - 313735S0523554W, 321614S0532811W ACT. RMK: LDG/TKOF OPS AT AD LOCATED WITHIN THE AREA ARE PPR, WITH A MNM NOTICE OF 2HR, BY TEL +55 (41) 3251-5243.  IMPACTED AWY WILL BE MANAGED BY THE ATS UNITS INVOLVED.  F) GND G) UNL",
FAA,81743542,K844/2026,SBCW,2026-07-20T00:00:00Z,2026-08-20T23:59:00Z,-32.316667,-52.683333,040,QRTCA,"K0844/26 NOTAMN  Q) SBCW/QRTCA/IV/BO/W/000/999/3219S05241W040  A) SBCW  B) 2607200000 C) 2608202359  E) TEMPORARY RESTRICTED AREA (ARCA 2) SUBJ COOR/AUTH CURITIBA ACC AND PELOTAS RDO WI COORD 325407S0525004W - 322354S0532320W - 314400S0523143W - 321351S0515922W - 325407S0525004W ACT  RMK: LDG/TKOF OPS AT AD LOCATED WITHIN THE AREA ARE PPR, WITH A MNM NOTICE OF 2HR, BY TEL +55 (41) 3251-5243.  IMPACTED AWY WILL BE MANAGED BY THE ATS UNITS INVOLVED.  F) GND G) UNL",
FAA,81749293,K847/2026,SBCW,2026-07-20T00:00:00Z,2026-08-20T23:59:00Z,-23.6,-53.316667,040,QRTCA,K0847/26 NOTAMN  Q) SBCW/QRTCA/IV/BO/W/000/999/2336S05319W040  A) SBCW  B) 2607200000 C) 2608202359  E) TEMPORARY RESTRICTED AREA SUBJ COOR/AUTH CURITIBA ACC WI COORD 235737S0534951W - 231846S0535324W - 231418S0524850W - 235335S0524556W - 235737S0534951W (ARCA 17) ACT.  RMK: LDG AND TKOF OPS AT AD LOCATED WITHIN THE AREA PPR MNM 2HR IN ADVANCE BY TEL +55 41 3251-5243.  F) GND G) UNL,
FAA,81749626,K850/2026,SBCW,2026-07-20T00:00:00Z,2026-08-20T23:59:00Z,-31.133333,-54.05,040,QRTCA,K0850/26 NOTAMN  Q) SBCW/QRTCA/IV/BO/W/000/999/3108S05403W040  A) SBCW  B) 2607200000 C) 2608202359  E) TEMPORARY RESTRICTED AREA SUBJ COOR/AUTH CURITIBA ACC AND BAGE RADIO WI COORD 311531S0544434W - 303217S0535558W - 305959S0532154W - 314334S0541037W - 311531S0544434W (ARCA 4) ACT.  RMK: LDG AND TKOF OPS AT AD LOCATED WITHIN THE AREA PPR MNM 2HR IN ADVANCE BY TEL +55 41 3251-5243.  COOR SBR518 AND SBR527.  F) GND G) UNL,
FAA,81749875,K851/2026,SBCW,2026-07-20T00:00:00Z,2026-08-20T23:59:00Z,-27.766667,-53.666667,040,QRTCA,K0851/26 NOTAMN  Q) SBCW/QRTCA/IV/BO/W/000/999/2746S05340W040  A) SBCW  B) 2607200000 C) 2608202359  E) TEMPORARY RESTRICTED AREA SUBJ COOR/AUTH CURITIBA ACC AND SANTO ANGELO RDO WI COORD 273633S0541827W - 271009S0534458W - 275430S0530028W - 282106S0533616W - 273633S0541827W (ARCA 12) ACT COOR SBR533. RMK: LDG AND TKOF OPS AT AD LOCATED WITHIN THE AREA PPR MNM 2HR IN ADVANCE BY TEL +55 41 3251-5243.  F) GND G) UNL,
FAA,81749965,K852/2026,SBCW,2026-07-20T00:00:00Z,2026-08-20T23:59:00Z,-24.35,-53.616667,040,QRTCA,K0852/26 NOTAMN  Q) SBCW/QRTCA/IV/BO/W/000/999/2421S05337W040  A) SBCW  B) 2607200000 C) 2608202359  E) TEMPORARY RESTRICTED AREA SUBJ COOR CURITIBA ACC CASCAVEL RDO AND TOLEDO RDO WI COORD 244319S0540745W - 240407S0541111W - 235922S0530658W - 243853S0530335W- 244319S0540745W (ARCA 16) ACT. RMK: LDG AND TKOF OPS AT AD LOCATED WITHIN THE AREA PPR MNM 2HR IN ADVANCE BY TEL +55 41 3251-5243.  F) GND G) UNL,
FAA,81750131,K853/2026,SBCW,2026-07-20T00:00:00Z,2026-08-20T23:59:00Z,-29.266667,-55.766667,040,QRTCA,K0853/26 NOTAMN  Q) SBCW/QRTCA/IV/BO/W/000/999/2916S05546W040  A) SBCW  B) 2607200000 C) 2608202359  E) TEMPORARY RESTRICTED AREA SUBJ COOR/AUTH CURITIBA ACC WI COORD 291219S0562705W - 284129S0555734W - 291921S0550441W - 295023S0553547W - 291219S0562705W (ARCA 9) ACT.  RMK: LDG AND TKOF OPS AT AD LOCATED WITHIN THE AREA PPR MNM 2HR IN ADVANCE BY TEL +55 41 3251-5243. COOR SBR535.  F) GND G) UNL,
FAA,81754608,K854/2026,SBCW,2026-07-20T00:00:00Z,2026-08-20T23:59:00Z,-26.0,-53.083333,040,QRTCA,"K0854/26 NOTAMN  Q) SBCW/QRTCA/IV/BO/W/000/999/2600S05305W040  A) SBCW  B) 2607200000 C) 2608202359  E) TEMPORARY RESTRICTED AREA (ARCA 14) WI COORD 262505S0533326W - 254551S0534128W - 253539S0523649W - 261404S0522848W - 262505S0533326W ACT. SUBJ COOR/AUTH ACC-CURITIBA AND RDO PATO BRANCO (COOR SBR820 SBR866 SBR867). RMK: LDG/TKOF OPS AT AD LOCATED WITHIN THE AREA PPR, WITH A MNM NOTICE OF 2HR, BY TEL +55 (41) 3251-5243. IMPACTED AWY WILL BE MANAGED BY THE ATS UNITS INVOLVED  F) GND G) UNL",
FAA,81757576,K855/2026,SBCW,2026-07-20T00:00:00Z,2026-08-20T23:59:00Z,-29.883333,-56.35,040,QRTCA,"K0855/26 NOTAMN  Q) SBCW/QRTCA/IV/BO/W/000/999/2953S05621W040  A) SBCW  B) 2607200000 C) 2608202359  E) TEMPORARY RESTRICTED AREA SUBJ AUTH CURITIBA ACC AND URUGUAIANA RDO WI COORD 294948S0570127W - 291818S0563225W -  295545S0553915W - 302752S0561024W - 294948S0570127W (ARCA 8) ACT. COOR SBR851, SBR539.  RMK: LDG AND TKOF OPS AT AD LOCATED WITHIN THE AREA PPR MNM 2HR IN ADVANCE BY TEL +55 41 3251-5243.  F) GND G) UNL",
FAA,81757889,K859/2026,SBCW,2026-07-20T00:00:00Z,2026-08-20T23:59:00Z,-28.166667,-54.45,040,QRTCA,K0859/26 NOTAMN  Q) SBCW/QRTCA/IV/BO/W/000/999/2810S05427W040  A) SBCW  B) 2607200000 C) 2608202359  E) TEMPORARY RESTRICTED AREA SUBJ COOR/AUTH CURITIBA ACC AND SANTO ANGELO RDO WI COORD 280058S0550648W - 273447S0543156W - 281912S0534757W - 284514S0542337W -  280058S0550648W (ARCA 11) ACT COOR SBR533 AND SBR534.  RMK: LDG AND TKOF OPS AT AD LOCATED WITHIN THE AREA PPR MNM 2HR IN ADVANCE BY TEL +55 41 3251-5243  F) GND G) UNL,
FAA,81762507,K860/2026,SBCW,2026-07-20T00:00:00Z,2026-08-20T23:59:00Z,-29.683333,-56.333333,040,QRTCA,K0860/26 NOTAMN  Q) SBCW/QRTCA/IV/BO/W/000/999/2941S05620W040  A) SBCW  B) 2607200000 C) 2608202359  E) TEMPORARY RESTRICTED AREA (ARCA 7) SUBJ COOR/AUTH CURITIBA ACC AND URUGUAIANA RDO WI COORD 294922S0570113W - 290608S0561431W - 293332S0553857W - 301700S0562640W - 294922S0570113W (COOR SBR851 SBR539) ACT.  RMK: OPS LDG OR TKOF IN AD INSIDE THE AREA SUBJ PREVIOUS MNM COOR  2HR  BY TEL +55 (41) 3251-5243  F) GND G) UNL,
FAA,81679263,K801/2026,SBCW,2026-08-03T06:00:00Z,2026-08-07T22:00:00Z,-26.183333,-50.25,030,QANCH,K0801/26 NOTAMN  Q) SBCW/QANCH/I/NBO/E/270/999/2611S05015W030  A) SBCW  B) 2608030600 C) 2608072200  D) DAILY 0600-2200  E) RNAV RTE UZ5 LOWER BDRY VER SEGMENT DOLDI/UMGES CHANGED TO FL270  F) FL270 G) UNL,
FAA,81679302,K802/2026,SBCW,2026-08-03T06:00:00Z,2026-08-07T22:00:00Z,-26.25,-50.4,030,QANCH,K0802/26 NOTAMN  Q) SBCW/QANCH/I/NBO/E/280/999/2615S05024W030  A) SBCW  B) 2608030600 C) 2608072200  D) DAILY 0600-2200  E) RNAV RTE UZ96 LOWER BDRY VER SEGMENT EGBUG/DOPOM CHANGED TO FL280  F) FL280 G) UNL,
FAA,81565958,K757/2026,SBCW,2026-08-03T09:00:00Z,2026-08-07T03:00:00Z,-30.083333,-54.983333,011,QWMLW,K0757/26 NOTAMN  Q) SBCW/QWMLW/IV/M/W/000/330/3005S05459W011  A) SBCW  B) 2608030900 C) 2608070300  D) 03-06 0900-0300  E) FRNG (LIVE FIRE)  WILL TAKE PLACE WI COORD 295655S0550625W - 295755S0545346W - 301406S0545307W - 301000S0550652W - 295655S0550625W (CAMPO DE INSTRUCAO BARAO DE SAO BORJA) COOR SBR517 SBR535  PROHIBITED  F) GND G) FL330,
FAA,81553735,A471/2026,GMMM,2026-07-01T00:00:00Z,2026-09-30T23:59:00Z,34.066667,-3.533333,014,QRDCA,A0471/26 NOTAMN  Q) GMMM/QRDCA/IV/BO/W/000/460/3404N00332W014  A) GMMM  B) 2607010000 C) 2609302359  E) GMD 07 (GUERCIF) ACT.  F) GND G) FL460,
FAA,81597574,A494/2026,GMMM,2026-07-01T06:00:00Z,2026-07-31T20:00:00Z,31.966667,-4.2,007,QWMLW,A0494/26 NOTAMN  Q) GMMM/QWMLW/IV/BO/W/000/460/3158N00412W007  A) GMMM  B) 2607010600 C) 2607312000  D) 0600-2000  E) SHOOTING ACTIVITY WILL TAKE PLACE IN ZONE  (RAHMAT ALLAH/ERRACHIDIA) DELIMITED BY FOLLOWING POINTS:  A: 320006.00N 0041806.04W;  B: 320140.95N 0040653.81W;  C: 315631.20N 0040607.72W;  D: 315411.08N 0041328.73W;  E: 315436.89N 0041801.97W;  A: 320006.00N 0041806.04W.  OBS: SUPERVISOR OF THIS ACTIVITY WILL COORDINATE  START AND END WITH GMFK CDT.  F) GND G) FL460,
FAA,81597593,A495/2026,GMMM,2026-07-02T06:00:00Z,2026-08-31T20:00:00Z,31.016667,-7.0,007,QWMLW,"A0495/26 NOTAMN  Q) GMMM/QWMLW/IV/BO/W/000/460/3101N00700W007  A) GMMM  B) 2607020600 C) 2608312000  D) JUL 02 08 0600-2000, AUG 28 31 0600-2000  E) SHOOTING ACTIVITY WILL TAKE PLACE IN ZONE (OUARZAZATE)  DELIMITED BY FOLLOWING POINTS:  A: 305955N 0070741W;  B: 310726N 0070147W;  C: 310324N 0065426W;  D: 305825N 0065322W;  E: 305726N 0065909W;  A: 305955N 0070741W.  OBS: START AND END OF ACTIVITY WILL BE COORDINATED WITH GMMZ CDT.  F) GND G) FL460",
FAA,81689390,A531/2026,GMMM,2026-07-07T09:00:00Z,2026-09-30T16:00:00Z,35.583333,-5.166667,005,QWELW,A0531/26 NOTAMN  Q) GMMM/QWELW/IV/BO/W/000/065/3535N00510W005  A) GMMM  B) 2607070900 C) 2609301600  D) MON-FRI 0900-1600  E) LANDING AND SCOOPING TRAINING ACTIVITY WILL TAKE PLACE IN ZONE  DELIMITED BY FOLLOWING POINTS:  353700N 0051500W;  353500N 0050500W;  353300N 0050500W;  353300N 0051200W;  353700N 0051500W.  OBS: CREWS CONCERNED WILL COORDINATE START AND END OF ACTIVITY  WITH ATC/GMTN.  F) SFC G) FL065,
FAA,81078780,D2578/2026,GCCC,2026-05-12T06:55:00Z,2026-08-08T23:59:00Z,27.483333,-12.0,039,QWELW,"D2578/26 NOTAMN  Q) GCCC/QWELW/IV/BO /W /150/460/2729N01200W039  A) GCCC B) 2605120655 C) 2608082359  E) AIR OPERATIONS WI 272552N 0122955W, 275652N 0112955W  270632N 0112955W, 270152N 0122955W, 272552N 0122955W  SAHARA  F) FL150 G) FL460",
FAA,81093999,B4293/2026,GCCC,2026-05-13T10:04:00Z,,26.033333,-17.766667,527,QAFXX,"B4293/26 NOTAMR B1230/26  Q) GCCC/QAFXX/IV/NBO/E /000/999/2602N01746W527  A) GCCC B) 2605131004 C) 2608162359EST  E) IN ACCORDANCE WITH COUNCIL DECISION (CFSP) 2021/908 , PERMISSION   TO LAND IN, TAKE-OFF FROM OR OVERFLY THE TERRITORY OF SPAIN SHALL   BE DENIED TO ANY AIRCRAFT OPERATED BY BELARUSIAN AIR CARRIERS,   INCLUDING AS A MARKETING CARRIER IN CODE-SHARING OR BLOCKED-SPACE   ARRANGEMENTS.    PREVIOUS PARAGRAPH SHALL NOT APPLY IN THE CASE OF AN EMERGENCY   LANDING OR AN EMERGENCY OVERFLIGHT. SPANISH AUTHORITIES MAY   DETERMINE NOT APPLICABILITY OF THE PARAGRAPH ABOVE WHEN A   LANDING, TAKE-OFF OR OVERFLIGHT IS REQUIRED FOR HUMANITARIAN   PURPOSES OR ANY OTHER PURPOSES.",
FAA,80849143,V15/2026,EGTT,2026-04-22T10:25:00Z,2026-07-20T23:00:00Z,51.466667,-14.85,,QROXX,V0015/26 NOTAMN  Q) EGXX/QROXX/IV/NBO/W /000/999/5128N01451W999  A) EGTT EGGX EGPX B) 2604221025 C) 2607202300  E) SECURITY - HAZARDOUS SITUATION IN LEBANON. UK REGISTERED AIR  OPERATORS ARE RECOMMENDED NOT TO ENTER FIR BEIRUT (OLBB).  POTENTIAL RISK FROM HEIGHTENED MILITARY ACTIVITY. FOR MORE INFO  CONTACT UK DEPARTMENT FOR TRANSPORT 02070 826639 OR 02079 443111  OUT OF HOURS. AR-2026-3194/01.  F) SFC G) UNL,
FAA,80822152,H1782/2026,EGTT,2026-04-27T07:00:00Z,2026-07-20T21:30:00Z,51.15,-1.383333,001,QWMLW,H1782/26 NOTAMN  Q) EGTT/QWMLW/IV/BO /W /000/011/5109N00123W001  A) EGTT B) 2604270700 C) 2607202130  D) 0700-2130  E) LIVE FIRING WI 0.7NM RADIUS OF 510911N 0012307W (MOODY&apos;S DOWN  SMALL ARMS RANGE). INCREASE TO AIR DANGER HEIGHT. FOR INFO 07970  337 862 / 07901 116 931. AR-2026-3078/02.  F) SFC G) 1100FT AMSL,
FAA,81046407,V19/2026,EGTT,2026-05-08T13:46:00Z,2026-08-06T12:15:00Z,52.3,-14.85,,QROXX,"V0019/26 NOTAMR V0018/26  Q) EGXX/QROXX/IV/NBO/W /000/999/5218N01451W999  A) EGPX EGTT EGGX B) 2605081346 C) 2608061215  E) SECURITY - HAZARDOUS SITUATION IN MALI.  UK CIVIL AIR OPERATORS ARE RECOMMENDED NOT TO ENTER FIR NIAMEY  (DRRR) AND FIR DAKAR (GOOO) WITHIN THE TERRITORY AND AIRSPACE OF  MALI BELOW 25,000 FT ABOVE GROUND LEVEL (AGL). POTENTIAL RISK  FROM ANTI-AIRCRAFT WEAPONRY AND HEIGHTENED MILITARY ACTIVITY.  THIS SUPERSEDES THE ADVICE IN THE CURRENT UK AIP ENR 1.1.  AR-2026-3729/01.  F) SFC G) UNL",
FAA,81242648,V20/2026,EGTT,2026-05-27T08:32:00Z,2026-08-25T12:00:00Z,52.3,-14.85,,QROXX,V0020/26 NOTAMR V0013/26  Q) EGXX/QROXX/IV/NBO/W /000/999/5218N01451W999  A) EGTT EGPX EGGX B) 2605270832 C) 2608251200  E) SECURITY - HAZARDOUS SITUATION IN AFGHANISTAN. UK REGISTERED AIR  OPERATORS ARE ADVISED TO TAKE POTENTIAL RISK INTO ACCOUNT WITHIN FIR   KABUL (OAKX). POTENTIAL RISK FROM HEIGHTENED MILITARY ACTIVITY.  AR-2026-1616/02.  F) SFC G) UNL,
FAA,81498398,H3339/2026,EGPX,2026-06-18T09:00:00Z,2026-09-16T16:00:00Z,56.166667,-3.383333,001,QWMLW,H3339/26 NOTAMN  Q) EGPX/QWMLW/IV/BO /W /000/019/5610N00323W001  A) EGPX B) 2606180900 C) 2609161600  D) 0900-1600  E) LIVE FIRING WI 0.25NM RADIUS OF 560936N 0032310W (1.25NM NW OF  LOCH ORE). HGT UP TO 750FT AGL. FOR INFO 07900 694044.  AR-2025-5911/05.  F) SFC G) 1900FT AMSL,
FAA,81515436,H3422/2026,EGPX,2026-06-23T07:00:00Z,2026-07-29T18:00:00Z,56.316667,-4.066667,003,QWMLW,H3422/26 NOTAMN  Q) EGPX/QWMLW/IV/BO /W /000/066/5619N00404W003  A) EGPX B) 2606230700 C) 2607291800  D) 0700-1800  E) FLARE FIRING WI 2NM RADIUS OF 561840N 0040331W (DALCHRUIN).  FOR  INFO 07900 565814. AR-2026-5267/01.  F) SFC G) 6600FT AMSL,
FAA,81696459,H3953/2026,EGPX,2026-07-13T07:00:00Z,2026-09-30T14:00:00Z,56.45,-2.75,003,QWMLW,"H3953/26 NOTAMN  Q) EGPX/QWMLW/IV/BO /W /000/008/5627N00245W003  A) EGPX B) 2607130700 C) 2609301400  D) JUL 13-SEP 29 0700-2259, SEP 30 0700-1400  E) LIVE FIRING WI AREA BOUNDED BY 562741N 0024748W - 562743N   0024129W - 562721N 0024128W - 562718N 0024748W - 562741N 0024748W   (BUDDON NESS). HGT UP TO 750FT AGL. FOR INFO 07990778961 /   07717542336.   AR-2026-5480/01.  F) SFC G) 750FT AMSL",
FAA,81421484,D119/2026,EISN,2026-07-01T06:00:00Z,2026-08-01T06:00:00Z,52.233333,-8.216667,002,QRDCA,"D0119/26 NOTAMN  Q) EISN/QRDCA/IV/BO /W /000/080/5214N00813W002  A) EISN B) 2607010600 C) 2608010600  E) DANGER AREA EID6 KILWORTH, CO. CORK ACTIVATED  F) GND G) 8000FT AMSL",
FAA,81421443,D117/2026,EISN,2026-07-16T09:00:00Z,2026-07-16T22:00:00Z,52.983333,-6.466667,005,QRDCA,"D0117/26 NOTAMN  Q) EISN/QRDCA/IV/BO /W /000/150/5259N00628W005  A) EISN B) 2607160900 C) 2607162200  E) DANGER AREA EID5 GLEN OF IMAAL, CO. WICKLOW ACTIVATED  F) GND G) 15000FT AMSL",
FAA,81421450,D118/2026,EISN,2026-07-17T09:00:00Z,2026-07-17T22:00:00Z,52.983333,-6.466667,005,QRDCA,"D0118/26 NOTAMN  Q) EISN/QRDCA/IV/BO /W /000/150/5259N00628W005  A) EISN B) 2607170900 C) 2607172200  E) DANGER AREA EID5 GLEN OF IMAAL, CO. WICKLOW ACTIVATED  F) GND G) 15000FT AMSL",
