country,id,notam_id,fir,from_utc,to_utc,lat,lon,radius_nm,qcode,raw,polygon
India,107436592318808101,C753/2011,VABF,2011-08-05T00:01:00Z,,19.1,72.83333333333333,5,QFAXX,"C0753/11 NOTAMR C0750/11  Q) VABF/QFAXX/IV/NBO/A /000/999/1906N07250E005  A) VAJJ PART 1 OF 3 B) 1108050001 C) PERM  E) AD DATA OF JUHU AIRPORT  ARP COOR   : 190551.2N 725001.8E  AD ELEV : 2.77M  AD REF TEMP : 33 DEG C  REFUELLING FAC: AVBL  HANGER  : NIL  AD CAT FOR FIRE FIGHTING : CAT IV (WITHIN ATS WATCH HRS)  APRON : SIZE 240M X 81.5 M , 115MX25M, 30M X 22.8M, 40M X 30M,   50M X 27M, SFC CONC .  TWY : TWY 'B' CONNECTED TO ?BFC? APRON-WIDTH 10.5M, SFC  BITUMEN AND TWY 'I' CONNECTED TO ?INDAMER? APRON-WIDTH 20 M,   END PART 1 OF 3  C0753/11 NOTAMR C0750/11  Q) VABF/QFAXX/IV/NBO/A /000/999/1906N07250E005  A) VAJJ PART 2 OF 3 B) 1108050001 C) PERM  E)   SFC BITUMEN RWY PHYSICAL DATA :  RWY NR   TRUE/MAG BRG     DIMENSION       THR COORDINATE  26       262 DEG 15 MIN   1133X30M        190554.2N0725002.1E  08       082 DEG 15 MIN   1133X30M        190552.4N0724949.1E  34       339 DEG 30 MIN   0732X20M        190550.9N0725011E  16       159 DEG 30 MIN   0732X20M        190557N0725002E  STRENGTH AND SFC :  RWY26/08 : 1133MX30M, LCN 10, BITUMEN  RWY34/16 : 0732MX20M, LCN/PCN VALUE NOT AVBL, BITUMEN  SWY, CWY, RESA : NOT AVBL  TURN PAD BEGINNING OF RWY : NOT AVBL  BLAST PAD BEGINNING OF RWY : NOT AVBL  RWY MARKINGS:  RWY EDGE, CENTRE LINE, THR, RWY DESIGNATION : AVBL  LIGHTING SYSTEM :  GROUND LIGHTING SYSTEM : NOT AVBL  PAPI RWY26 : NOT AVBL  PAPI RWY08 : NOT AVBL  END PART 2 OF 3  C0753/11 NOTAMR C0750/11  Q) VABF/QFAXX/IV/NBO/A /000/999/1906N07250E005  A) VAJJ PART 3 OF 3 B) 1108050001 C) PERM  E)    NDB             : NOT AVBL  ABN : NOT AVBL  WIND SOCK : AVBL  SIGNAL AREA : AVBL  DECLARED DIST:  RWY DESIGNATION TORA(M)  TODA(M)   ASDA(M)     LDA(M)  RWY26           1133      1133       1133       649  RWY08           1133      1133       1133       1033  RWY34           732       732        732        732  RWY16           732       732        732        732  ATS COMM  FAC : VHF 124.35 MHZ  CTL ZONE : NIL  LOCAL FLYING   : NIL  MET SER        : AVBL  NOTE :)  1. OPERATORS INTENDING TO OPR PRIOR TO 0730 IST IN THE MORNINGS      TO FILE PLAN THE PREVIOUS DAY? WITH JUHU ATC FOR DEP AND      INTIMATE IN WRITING FOR ARR TO JUHU.  2.  PRKG ALLOTED ON FIRST COME FIRST SERVED BASIS. APRON SPACE IN      ONGC, UHPL, GLOBAL VECTRA, BFC APRONS ALSO WILL BE       UTILIZED BY ATC, DEPENDING ON VACANCY AND DEMAND   3.  PILOTS TO EXER CTN DUE TALL TREES ON THE FINAL APCH OF RWY26.  4.  FOR NON-JUHU BASED OPR, 48 HOURS PN DUE LIMITED PRKG      SPACE AVAILABILITY.)  END PART 3 OF 3    CREATED: 01 JUN 2014 13:51  SOURCE: VABBYNYX    C0753/11 NOTAMR C0750/11  Q) VABF/QFAXX/IV/NBO/A /000/999/1906N07250E005  A) VAJJ PART 2 OF 3 B) 1108050001 C) PERM  E)   SFC BITUMEN RWY PHYSICAL DATA :  RWY NR   TRUE/MAG BRG     DIMENSION       THR COORDINATE  26       262 DEG 15 MIN   1133X30M        190554.2N0725002.1E  08       082 DEG 15 MIN   1133X30M        190552.4N0724949.1E  34       339 DEG 30 MIN   0732X20M        190550.9N0725011E  16       159 DEG 30 MIN   0732X20M        190557N0725002E  STRENGTH AND SFC :  RWY26/08 : 1133MX30M, LCN 10, BITUMEN  RWY34/16 : 0732MX20M, LCN/PCN VALUE NOT AVBL, BITUMEN  SWY, CWY, RESA : NOT AVBL  TURN PAD BEGINNING OF RWY : NOT AVBL  BLAST PAD BEGINNING OF RWY : NOT AVBL  RWY MARKINGS:  RWY EDGE, CENTRE LINE, THR, RWY DESIGNATION : AVBL  LIGHTING SYSTEM :  GROUND LIGHTING SYSTEM : NOT AVBL  PAPI RWY26 : NOT AVBL  PAPI RWY08 : NOT AVBL  END PART 2 OF 3  CREATED: 01 JUN 2014 13:51  SOURCE: VABBYNYX    C0753/11 NOTAMR C0750/11  Q) VABF/QFAXX/IV/NBO/A /000/999/1906N07250E005  A) VAJJ PART 3 OF 3 B) 1108050001 C) PERM  E)    NDB             : NOT AVBL  ABN : NOT AVBL  WIND SOCK : AVBL  SIGNAL AREA : AVBL  DECLARED DIST:  RWY DESIGNATION TORA(M)  TODA(M)   ASDA(M)     LDA(M)  RWY26           1133      1133       1133       649  RWY08           1133      1133       1133       1033  RWY34           732       732        732        732  RWY16           732       732        732        732  ATS COMM  FAC : VHF 124.35 MHZ  CTL ZONE : NIL  LOCAL FLYING   : NIL  MET SER        : AVBL  NOTE :)  1. OPERATORS INTENDING TO OPR PRIOR TO 0730 IST IN THE MORNINGS      TO FILE PLAN THE PREVIOUS DAY? WITH JUHU ATC FOR DEP AND      INTIMATE IN WRITING FOR ARR TO JUHU.  2.  PRKG ALLOTED ON FIRST COME FIRST SERVED BASIS. APRON SPACE IN      ONGC, UHPL, GLOBAL VECTRA, BFC APRONS ALSO WILL BE       UTILIZED BY ATC, DEPENDING ON VACANCY AND DEMAND   3.  PILOTS TO EXER CTN DUE TALL TREES ON THE FINAL APCH OF RWY26.  4.  FOR NON-JUHU BASED OPR, 48 HOURS PN DUE LIMITED PRKG      SPACE AVAILABILITY.)  END PART 3 OF 3  CREATED: 01 JUN 2014 13:51  SOURCE: VABBYNYX",
India,107558653158668677,A1650/2018,VOMF,2018-07-01T02:30:00Z,,14.016666666666667,74.3,15,QRDCA,A1650/18 NOTAMN  Q) VOMF/QRDCA/IV/BO /W /000/280/1401N07418E015  A) VOMF B) 1807010230 C) PERM  D) 01-07 15-21 0230-0930  E) VOD-178 (PIGEON ISLAND) ACT.  F) SFC G) 28000FT AMSL    CREATED: 01 FEB 2024 15:13  SOURCE: EUECYIYN,
India,107558653175445893,A1651/2018,VOMF,2018-07-01T09:30:00Z,,14.016666666666667,74.3,15,QRDCA,A1651/18 NOTAMN  Q) VOMF/QRDCA/IV/BO /W /000/115/1401N07418E015  A) VOMF B) 1807010930 C) PERM  D) 01-07 15-21 0930-1130  E) VOD-178 (PIGEON ISLAND) ACT.  F) SFC G) 11500FT AMSL    CREATED: 01 FEB 2024 15:13  SOURCE: EUECYIYN,
India,107558653192223109,A1652/2018,VOMF,2018-07-01T02:30:00Z,,15.2,73.91666666666667,4,QWMLW,"A1652/18 NOTAMN  Q) VOMF/QWMLW/IV/BO /W /000/115/1512N07355E004  A) VOMF B) 1807010230 C) PERM  D) 01-07 14-21  0230-1230  E) NAVAL ACFT WILL CARRY OUT AIR TO GND FRNG PRACTICE AT     CAVELOSSIM RANGE WI AREA BOUNDED BY THE FLW COORD     1513.00N 07357.00E, 1513.00N 07352.00E,     1511.00N 07357.00E, 1511.00N 07352.00E  F) SFC G) 11500FT AMSL    CREATED: 01 FEB 2024 15:13  SOURCE: EUECYIYN",
SRI LANKA,107699363803467237,A50/2026,VDPF,2026-04-21T10:02:00Z,2026-07-21T23:59:00Z,,,,QRDCA,A0050/26 NOTAMR A0009/26  Q) VDPF/QRDCA/IV/BO/W/000/999/  A) VDPF B) 2604211002 C) 2607212359 EST  E) DANGER ACTIVATION WI AREA  135142N1024559E-135005N1040114E-135623N1051516E-140942N1051736E-  142053N1051207E-141206N1050442E-142125N1045929E-142623N1044758E-  142029N1043111E-142404N1041507E-142005N1040009E-142154N1034748E-  142653N1034104E-141954N1030914E-141219N1025717E-135142N1024559E-  RMK: EASTBOUND FLIGHTS USING L880 AND G474 SHOULD FILE RE-ROUTE FPL  ENTERING PHNOM PENH FIR AT AGEDO AND THEN USING B204 REP W14 VIBUN  L880 VEMKO G474  F) GND  G) UNL    CREATED: 21 APR 2026 10:08  SOURCE: VDPFYNYX,
Brazil,107704314944357426,J249/2026,SBBS,2026-04-16T00:00:00Z,,-20.666666666666668,-49.63333333333333,70,QRRCH,J0249/26 NOTAMN  Q) SBBS/QRRCH/IV/BO/W/240/999/2040S04938W070  A) SBBS  B) 2604160000 C) PERM  E) SBR454 (GAVIAO UNO) ACTIVITY CHANGED TO H24  REF: AIP ENR 5.1  F) FL240 G) UNL    CREATED: 29 MAR 2026 11:52  SOURCE: SBRJYNYX,
Brazil,107704863827756118,K197/2026,SBCW,2026-02-18T21:31:00Z,,-22.916666666666668,-45.78333333333333,10,QRRCH,K0197/26 NOTAMN  Q) SBCW/QRRCH/IV/BO/W/000/999/2255S04547W010  A) SBCW  B) 2602182131 C) PERM  E) SBR421 (XAVANTE B) CHANGED RMK  FROM: UNDER COORD OF SAO PAULO APP IN QRG 119.525 MHZ  TO: UNDER COORD OF RIO DE JANEIRO APP IN QRG 119.525 MHZ PRY / 124.700 MHZ SRY  REF: AIP ENR 5.1  F) GND G) UNL  CREATED: 18 FEB 2026 21:46  SOURCE: SBRJYNYX,
Lebanon,107488256815737889,A5/2014,OLBB,2014-01-10T09:56:00Z,,33.86666666666667,35.1,64,QRRXX,"A0005/14 NOTAMR A0004/14  Q) OLBB/QRRXX/IV/BO /W /000/999/3352N03506E064  A) OLBB B) 1401100956 C) PERM  E) NAVAL SHIPS OF THE UNIFIL MARITIME TASK FORCE (MTF) ARE OPERATING  UNDER UN SECURITY COUNCIL RESOLUTION 1701 (2006) IN THE AREA   DELINEATED BY THE AREA OUT OF 12 MILES FROM THE LEBANESE COAST   LINE, AND BY THE COORDINATES:  -343800N 0355800E  -343800N 0350000E  -330600N 0341500E  -330600N 0350600E  ALL VFR FLIGHTS MUST AVOID OVERFLYING IN A RADIUS OF 3NM WHEN   THEIR ALTITUDE IS LESS THAN 4000FT AROUND A UNIFIL NAVAL VESSEL   IN THESE MENTIONED AREA ABOVE, EXCEPT COMMERCIAL FLIGHT WHEN   THEY ARE SUBJECT TO ATC CLEARANCE FOR AVOIDING BAD WEATHER OR   HOLDING PROCEDURES. AIRCRAFT INTRUDING WITHIN THIS AIRSPACE   WOULD CONSTITUTE A SECURITY RISK AND HENCE MAY BE ENGAGED BY THE  SHIP&apos;S AIR DEFENCE SYSTEM.  F) SFC G) UNL)    CNN001I ADMIN MESSAGE    CREATED: 10 JAN 2014 10:05  SOURCE: OLBAYNYX",
Spain,107701034629304385,D1335/2026,LECB,2026-03-18T06:00:00Z,2026-11-20T22:00:00Z,39.916666666666664,3.283333333333333,11,QWELW,"D1335/26 NOTAMN  Q) LECB/QWELW/IV/BO /W /000/035/3955N00317E011  A) LECB B) 2603180600 C) 2611202200  D) MAR 18-20 24-27 0600-2200, APR 08-10 0600-2200, MAY 05-08 19-22   0600-2200, JUN 03-05 0600-2200, SEP 03-05 16-18 0600-2200, OCT 20-23   0600-2200, NOV 03-07 17-20 0600-2200  E) SAR EXERCISES WITH LIFE RAFT CHAINS AND FLARES LAUNCHING  WI 395400N 0030400E, 400600N 0031600E, 395600N 0032900E,  395100N 0030600E, 395400N 0030400E  MALLORCA/POLLENSA    RMK: THE ACTIVATION/DEACTIVATION OF THIS AREA WILL BE CARRIED OUT        IN REAL TIME BY TACTICAL COORDINATION WITH ECAO (OPERATIVE       AIR TRAFFIC SQUADRON) BARCELONA.  F) SFC G) 03500FT AMSL  CREATED: 17 MAR 2026 12:14  SOURCE: EUECYIYN",
Chad,107646608753217139,A1332/2023,FTTT,2023-12-18T14:35:00Z,,15.1,18.416666666666668,575,QARXX,"A1332/23 NOTAMN   Q) FTTT/QARXX/IV/NBO/E/000/999/1506N01825E575  A) FTTT B) 2312181435 C) PERM  E) ENR6.1 RADIONAVIGATION CHART - LOWER SPACE WEST AND CENTRAL   AFRICA  NDJAMENA FIR:   DELETE ATS ROUTE M214  ASECNA AIP MODIFY PAGE 00ENR6-ASECNA-ENRC-OCL      CNS123W SEQUENCE CHECK FOR FCCCYNYX A --     EXPECTED A0178/24 -- RECEIVED A1332/23  CNN038W DUPLICATE NOTAM  TRANSACTION ROLLED BACK, RETCODE = 14    CREATED: 20 DEC 2023 13:58  SOURCE: FCCCYNYX",
Chad,107646608786771571,A1334/2023,FTTT,2023-12-18T14:59:00Z,,15.1,18.416666666666668,575,QCAXX,"A1334/23 NOTAMN  Q) FTTT/QCAXX/IV/BO /E /000/999/1506N01825E575  A) FTTT B) 2312181459 C) PERM  E) ENR6.1 RADIONAVIGATION CHARTS - LOWER SPACE WEST AND CENTRAL   AFRICA   TMA ABECHE:  READ TWR FREQ 119.1MHZ INSTEAD OF NIL  ASECNA AIP INSERT INFO INTO PAGE 00ENR6-ASECNA-ENRC-OCL      CNS123W SEQUENCE CHECK FOR FCCCYNYX A --     EXPECTED A0786/25 -- RECEIVED A1334/23  CNN038W DUPLICATE NOTAM  TRANSACTION ROLLED BACK, RETCODE = 14    CREATED: 20 DEC 2023 13:56  SOURCE: FCCCYNYX",
Switzerland,107711462877022226,W315/2026,LSAS,2026-05-18T06:00:00Z,2026-07-23T21:00:00Z,47.03333333333333,8.85,3,QRDCA,W0315/26 NOTAMN  Q) LSAS/QRDCA/V/BO/W/000/059/4702N00851E003  A) LSAS B) 2605180600 C) 2607232100  D) MAY 18-21 26-28 JUN 01-03 08-11 15-18 22-25 29-JUL 02 06-09 13-16  20-23 0600-1000 1100-2100  E) D-AREA LSD12 SIHLTAL ACT.  F) GND  G) 5900FT AMSL    CREATED: 05 FEB 2026 12:19  SOURCE: LSSNYNYX,
Switzerland,107711462893799442,W316/2026,LSAS,2026-08-03T06:00:00Z,2026-10-14T21:00:00Z,47.03333333333333,8.85,3,QRDCA,W0316/26 NOTAMN  Q) LSAS/QRDCA/V/BO/W/000/059/4702N00851E003  A) LSAS B) 2608030600 C) 2610142100  D) AUG 03-06 10-13 17-20 24-27 31-SEP 03 07-10 14-17 21-24 28-OCT 01  05-08 12-14 0600-1000 1100-2100  E) D-AREA LSD12 SIHLTAL ACT.  F) GND  G) 5900FT AMSL    CREATED: 05 FEB 2026 12:23  SOURCE: LSSNYNYX,
Congo,107664179112085570,A31/2024,FCCC,2024-01-10T13:27:00Z,,-3.1333333333333333,8.783333333333333,319,QARXX,"A0031/24 NOTAMN  Q) FCCC/QARXX/IV/NBO/E /000/999/0308S00847E319  A) FCCC B) 2401101327 C) PERM  E) ENR6.1 RADIONAVIGATION CHARTS-LOWER SPACE WEST AND CENTRAL AFRICA.  ATS ROUTE A400: READ ONLEN INSTEAD OF ONPOX  ATS ROUTE R987: READ NIL INSTEAD OF SIBEX  ASECNA AIP MODIFY 00ENR6-ASECNA-ENRC-OCL      CNS123W SEQUENCE CHECK FOR FCCCYNYX A --     EXPECTED A0786/25 -- RECEIVED A0031/24  CNN038W DUPLICATE NOTAM  TRANSACTION ROLLED BACK, RETCODE = 14    CREATED: 10 JAN 2024 13:35  SOURCE: FCCCYNYX",
Congo,107629002239412290,A478/2022,FCCC,2022-04-29T15:18:00Z,,-1.8833333333333333,11.933333333333334,5,QXXXX,A0478/22 NOTAMN  Q) FCCC/QXXXX/IV/NBO/E /000/999/0153S01156E005  A) FCCC B) 2204291518 C) PERM  E) GABON/  AERONAUTICAL FIXED SERVICES  LINK FOOO-FOOK  READ: SATELLITE LINK INSTEAD OF LIAISON BLU  LINK FOOO-FOOR  READ: LIAISON BLU INSTEAD OF SATELLITE LINK  ASECNA EAIP MODIFY 07GEN3-FO-RSFTA    CREATED: 02 DEC 2023 00:07  SOURCE: EUECYIYN,
Congo,107629002172303426,A474/2022,FCCC,2022-04-29T15:02:00Z,,-1.8833333333333333,11.933333333333334,5,QOAXX,"A0474/22 NOTAMN  Q) FCCC/QOAXX/IV/NBO/E /000/999/0153S01156E005  A) FCCC B) 2204291502 C) PERM  E) GABON/  AERONAUTICAL FIXED SERVICES  -INSERT:   SATELLITE LINK: FOOO-DXXX  SATELLITE LINK: FOOO-FGSL  -READ LINK FOOO-FOGM INSTEAD OF FOOO-FOOA  -DELETION OF THE FOLLOWING LINKS:  FOOO-DIII, FOOO-FGBT, FOOO-FPST,FOOO-FOOD,  FOOO-FOOY,FOOO-FOOM,FOOO-FOOE, FOOO-FOOC.  ASECNA AIP MODIFY PAGE 07GEN3-FO-RSFTA      CNS123W SEQUENCE CHECK FOR FCCCYNYX A --     EXPECTED A0786/25 -- RECEIVED A0474/22  CNN038W DUPLICATE NOTAM  TRANSACTION ROLLED BACK, RETCODE = 14    CREATED: 02 DEC 2023 00:07  SOURCE: EUECYIYN",
Malaysia,107701021040116898,D525/2026,WBFC,2026-06-01T00:00:00Z,2026-08-31T23:59:00Z,5.6,113.71666666666667,33,QWELW,D0525/26 NOTAMN  Q) WBFC/QWELW/IV/BO /W /000/100/0536N11343E033  A) WBFC B) 2606010000 C) 2608312359   E)MIL EXER WILL TAKE PLACE IN THE AREA BOUNDED BY THE FLW CORD:  SECTOR A  053344N 1131042E  060605N 1135044E  053459N 1141641E  050559N 1133956E  053344N 1131042E    F) SFC                             G) 10000FT AMSL    CREATED: 12 MAY 2026 16:26  SOURCE: WMKKYNYX,
Malaysia,107701021006562466,D523/2026,WBFC,2026-06-01T00:00:00Z,2026-08-31T23:59:00Z,5.133333333333334,114.15,30,QWELW,D0523/26 NOTAMN  Q) WBFC/QWELW/IV/BO /W /000/050/0508N11409E030  A) WBFC B) 2606010000 C) 2608312359   E)MIL EXER WILL TAKE PLACE IN THE AREA BOUNDED BY THE FLW COORD:  SECTOR B  050559N 1133956E  053459N 1141641E  050800N 1143943E  044200N 1140448E  050559N 1133956E    F) SFC                             G) 5000FT AMSL    CREATED: 12 MAY 2026 16:12  SOURCE: WMKKYNYX,
Turkey,107681870351027959,A5935/2025,LTXX,2026-01-02T05:00:00Z,2026-12-31T16:00:00Z,40.233333333333334,25.1,26,QWELW,"A5935/25 NOTAMN  Q) LTXX/QWELW/IV/BO /W /000/100/4014N02506E026  A) LTBB LGGG PART 1 OF 2 B) 2601020500 C) 2612311600  E) NAVIGATIONAL WARNING TO ALL CONCERNED:    1. TURKIYE REQUESTED THE GREEK AIS TO PROMULGATE APPROPRIATE NOTAM   FOR THE EXERCISE AREA LOCATED WITHIN INTERNATIONAL WATERS AND   AIRSPACE OF AEGEAN SEA REGARDING THE TURKISH NAVY AND AIRFORCE   FIRING MILITARY EXERCISE (ASFAO) TO BE CONDUCTED FROM  02 JAN TILL   31 DEC 2026 0500-1600 UTC(EXCEPT SATURDAYS,SUNDAYS,HOLIDAYS) WITH   REF 250822 LTAAYNYX DEC 2025.  GREEK AIS DID NOT PROMULGATE APPROPRIATE NOTAM FOR THE EXERCISE  AREA IN ACCORDANCE WITH OUR REF 250822 DEC 2025.  UNDER THESE CIRCUMSTANCES DUE TO THE INSISTENT ATTITUDE OF GREECE,   TURKIYE IS LEFT WITH NO OTHER ALTERNATIVE BUT TO TAKE ITS OWN   INITATIVE TO PROMULGATE THE NECESSARY NOTAM FOR THE EXERCISE AREA.  TURKIYE WILL TAKE NECESSARY MEASURES FOR THE SAFETY OF THE GENERAL  AIR TRAFFIC AS SHE DID IN THE PAST AND IS ALWAYS READY FOR   COOPERATION AND COORDINATION IN THIS RESPECT.    2. THE NOTAM INFORMATION FOR THE EXERCISE AREA IS AS FOLLOWED.  TURKISH NAVY AND AIRFORCE SHALL MAKE &apos;ASFAO&apos; EXERCISE IN   INTERNATIONAL WATERS AND AIRSPACE OF AEGEAN SEA AS DESCRIBED BELOW    3. EXERCISE AREA:   A. LATERAL LIMITS:    AREA: 401630N0253900E 401800N0253000E 403500N0245800E   401100N0243300E 400900N0244500E 402000N0245600E 400700N0253300E   401630N0253900E  B.VERTICAL LIMITS: SFC-10000FT AMSL     C. DATE AND TIMES:   02 JAN 0500-1600  05-30 JAN 0500-1600 EXC SAT SUN   02-27 FEB 0500-1600 EXC SAT SUN  02-13 MAR 0500-1600 EXC SAT SUN  16-18 MAR 0500-1600  END PART 1 OF 2  A5935/25 NOTAMN  Q) LTXX/QWELW/IV/BO /W /000/100/4014N02506E026  A) LTBB LGGG PART 2 OF 2 B) 2601020500 C) 2612311600  E) 23 MAR-17 APR 0500-1600 EXC SAT SUN  20-22 APR 0500-1600  24 APR 0500-1600  27-30 APR 0500-1600 04-15 MAY 0500-1600 EXC SAT SUN   18 MAY 0500-1600  20-22 MAY 0500-1600  25 MAY 0500-1600  01 JUN-10 JUL 0500-1600 EXC SAT SUN  13-14 JUL 0500-1600  16-17 JUL 0500-1600  20 JUL-23 OCT 0500-1600 EXC SAT SUN  26-27 OCT 0500-1600  30 OCT 0500-1600  02 NOV-31 DEC 0500-1600 EXC SAT SUN       4. PROCEDURES FOR EXERCISE AIRCRAFT:  A. THE FLIGHTS WILL BE CONDUCTED UNDER VFR CONDITIONS AND UNDER THE   POSITIVE RADAR CONTROL.  B. EXERCISE AIRCRAFT SHALL DISPLAY ANTI/COLLISION AND NAVIGATION   LIGHTS CONTINUOUSLY.    5. PROCEDURES FOR NON-EXERCISE AIRCRAFT:  IN THE INTEREST OF FLYING SAFETY DURING THE EXERCISE NON-EXERCISE    AIRCRAFT ARE STRONGLY ADVISED NOT TO FLY WITHIN THE EXERCISE AREA   DESCRIBED ABOVE.  F) SFC G) 10000FT AMSL  END PART 2 OF 2    CREATED: 30 DEC 2025 10:55  SOURCE: EUECYIYN",
Turkey,107681870384582391,A5937/2025,LTXX,2026-01-02T05:00:00Z,2026-12-31T16:00:00Z,39.11666666666667,24.916666666666668,14,QWELW,"A5937/25 NOTAMN  Q) LTXX/QWELW/IV/BO /W /000/060/3907N02455E014  A) LTBB LGGG PART 1 OF 2 B) 2601020500 C) 2612311600  E) NAVIGATIONAL WARNING TO ALL CONCERNED:    1. TURKIYE REQUESTED THE GREEK AIS TO PROMULGATE APPROPRIATE NOTAM   FOR THE EXERCISE AREA LOCATED WITHIN INTERNATIONAL WATERS AND   AIRSPACE OF AEGEAN SEA REGARDING THE TURKISH NAVY AND AIRFORCE   FIRING MILITARY EXERCISE (ASFAO) TO BE CONDUCTED FROM 02 JAN TILL   31 DEC 2026 0500-1600UTC (EXCEPT SATURDAYS, SUNDAYS, HOLIDAYS) WITH   REF 250829 LTAAYNYX DEC 2025.  GREEK AIS DID NOT PROMULGATE APPROPRIATE NOTAM FOR THE EXERCISE  AREA IN ACCORDANCE WITH OUR REF 250829 DEC 2025. UNDER THESE   CIRCUMSTANCES DUE TO THE INSISTENT ATTITUDE OF GREECE, TURKIYE IS   LEFT WITH NO OTHER ALTERNATIVE BUT TO TAKE ITS OWN INITATIVE TO   PROMULGATE THE NECESSARY NOTAM FOR THE EXERCISE AREA.  TURKIYE WILL TAKE NECESSARY MEASURES FOR THE SAFETY OF THE GENERAL  AIR TRAFFIC AS SHE DID IN THE PAST AND IS ALWAYS READY FOR   COOPERATION AND COORDINATION IN THIS RESPECT.    2. THE NOTAM INFORMATION FOR THE EXERCISE AREA IS AS FOLLOWED.  TURKISH NAVY AND AIRFORCE SHALL MAKE &apos;ASFAO&apos; EXERCISE IN   INTERNATIONAL WATERS AND AIRSPACE OF AEGEAN SEA AS DESCRIBED BELOW.  A5937/25 NOTAMN  Q) LTXX/QWELW/IV/BO /W /000/060/3907N02455E014  A) LTBB LGGG PART 2 OF 2 B) 2601020500 C) 2612311600  E)  3. EXERCISE AREA:   A. LATERAL LIMITS:  AREA: 390000N0251000E 392000N0245800E 391400N0244000E   385400N0245200E 390000N0251000E  B. VERTICAL LIMITS: SFC-6000FT AMSL  C. DATE AND TIMES:   JAN 02 0500-1600  JAN 05-30 MON-FRI 0500-1600  FEB 02-MAR 18 MON-FRI 0500-1600  MAR 23-APR 22 MON-FRI 0500-1600  APR 24 0500-1600  APR 27-APR 30 0500-1600  MAY 04-15 MON-FRI 0500-1600  MAY 18 0500-1600  MAY 20-22 0500-1600  MAY 25 0500-1600  JUN 01-JUL 10 MON-FRI 0500-1600  JUL 13 14 16 17 0500-1600    CREATED: 30 DEC 2025 11:24  SOURCE: EUECYIYN",
Turkey,107681870367805175,A5936/2025,LTXX,2026-01-02T05:00:00Z,2026-12-31T16:00:00Z,37.266666666666666,26.233333333333334,14,QWELW,"A5936/25 NOTAMN  Q) LTXX/QWELW/IV/BO /W /000/100/3716N02614E014  A) LTBB LGGG PART 1 OF 2 B) 2601020500 C) 2612311600  E) NAVIGATIONAL WARNING TO ALL CONCERNED:    1. TURKIYE REQUESTED THE GREEK AIS TO PROMULGATE APPROPRIATE NOTAM   FOR THE EXERCISE AREA LOCATED WITHIN INTERNATIONAL WATERS AND   AIRSPACE OF AEGEAN SEA REGARDING THE TURKISH NAVY AND AIRFORCE   FIRING MILITARY EXERCISE (ASFAO) TO BE CONDUCTED FROM 02 JAN TILL   31 DEC 2026 0500-1600UTC (EXCEPT SATURDAYS, SUNDAYS, HOLIDAYS) WITH   REF 250826 LTAAYNYX DEC 2025.  GREEK AIS DID NOT PROMULGATE APPROPRIATE NOTAM FOR THE EXERCISE  AREA IN ACCORDANCE WITH OUR REF 250826 DEC 2025. UNDER THESE   CIRCUMSTANCES DUE TO THE INSISTENT ATTITUDE OF GREECE, TURKIYE IS   LEFT WITH NO OTHER ALTERNATIVE BUT TO TAKE ITS OWN INITATIVE TO   PROMULGATE THE NECESSARY NOTAM FOR THE EXERCISE AREA.  TURKIYE WILL TAKE NECESSARY MEASURES FOR THE SAFETY OF THE GENERAL  AIR TRAFFIC AS SHE DID IN THE PAST AND IS ALWAYS READY FOR   COOPERATION AND COORDINATION IN THIS RESPECT.    2. THE NOTAM INFORMATION FOR THE EXERCISE AREA IS AS FOLLOWED.  TURKISH NAVY AND AIRFORCE SHALL MAKE &apos;ASFAO&apos; EXERCISE IN   INTERNATIONAL WATERS AND AIRSPACE OF AEGEAN SEA AS DESCRIBED BELOW.    3. EXERCISE AREA:   A. LATERAL LIMITS:  AREA: 372700N0261700E 370830N0262730E 370500N0260900E   372400N0260000E 372400N0260400E 372700N0261700E  B. VERTICAL LIMITS: SFC-10000FT AMSL  C. DATE AND TIMES:  END PART 1 OF 2  A5936/25 NOTAMN  Q) LTXX/QWELW/IV/BO /W /000/100/3716N02614E014  A) LTBB LGGG PART 2 OF 2 B) 2601020500 C) 2612311600  E) JAN 02 0500-1600  JAN 05-30 MON-FRI 0500-1600  FEB 02-MAR 18 MON-FRI 0500-1600  MAR 23-APR 22 MON-FRI 0500-1600  APR 24 0500-1600  APR 27-APR 30 0500-1600  MAY 04-15 MON-FRI 0500-1600  MAY 18 0500-1600  MAY 20-22 0500-1600  MAY 25 0500-1600  JUN 01-JUL 10 MON-FRI 0500-1600   JUL 13 14 16 17 0500-1600  JUL 20-OCT 23 MON-FRI 0500-1600  OCT 26 27 30 0500-1600  NOV 02- DEC 31 MON-FRI 0500-1600    4. PROCEDURES FOR EXERCISE AIRCRAFT:  A. THE FLIGHTS WILL BE CONDUCTED UNDER VFR CONDITIONS AND UNDER THE   POSITIVE RADAR CONTROL.  B. EXERCISE AIRCRAFT SHALL DISPLAY ANTI/COLLISION AND NAVIGATION   LIGHTS CONTINUOUSLY.    5. PROCEDURES FOR NON-EXERCISE AIRCRAFT:  IN THE INTEREST OF FLYING SAFETY DURING THE EXERCISE NON-EXERCISE    AIRCRAFT ARE STRONGLY ADVISED NOT TO FLY WITHIN THE EXERCISE AREA   DESCRIBED ABOVE.  F) SFC G) 10000FT AMSL  END PART 2 OF 2    CREATED: 30 DEC 2025 11:07  SOURCE: EUECYIYN",
United Kingdom,107710907987139319,V9/2026,EGXX,2026-02-20T13:38:00Z,,52.3,-14.85,,QROXX,V0009/26 NOTAMN  Q) EGXX/QROXX/IV/NBO/W /000/999/5218N01451W999  A) EGTT EGPX EGGX B) 2602201338 C) PERM  E) SECURITY - HAZARDOUS SITUATION IN LIBYA  UK REGISTERED AIR OPERATORS ARE RECOMMENDED NOT TO ENTER FIR  TRIPOLI (HLLL). POTENTIAL RISK FROM ANTI-AIRCRAFT WEAPONRY.  THIS SUPERSEDES THE ADVICE IN THE CURRENT UK AIP.  UK AIP ENR 1.1. PARA 1.4.5 REFERS.  F) SFC G) UNL  CREATED: 20 FEB 2026 13:52  SOURCE: EUECYIYN,
France,107708726596965409,R1060/2026,LFBB,2026-04-23T08:00:00Z,2027-03-25T20:00:00Z,44.916666666666664,0.8333333333333334,77,QRTTT,R1060/26 NOTAMN  Q) LFBB/QRTTT/IV/BO /W /165/999/4455N00050E077  A) LFBB B) 2604230800 C) 2703252000  E) TRIGGER NOTAM - AIP SUP 062/26.  CREATION OF 3 TEMPORARY RESTRICTED AREAS (&apos;ZRT&apos;) AT MEDIUM AND HIGH   ALTITUDE FOR THE TRAINING AREAS FOR NEW ARMAMENTS (&apos;ZENA&apos;) AND   ASSOCIATED FBZ.  THIS AIP SUP IS AVBL AT WWW.SIA.AVIATION-CIVILE.GOUV.FR  F) FL165 G) UNL    CREATED: 09 APR 2026 06:34  SOURCE: EUECYIYN,
FAA,81542874,A2363/2026,ZBPE,2026-06-30T16:00:00Z,2026-08-31T15:59:00Z,39.816667,119.5,009,QRPCA,A2363/26 NOTAMN  Q)ZXXX/QRPCA/IV/NBO/W/000/999/3949N11930E009  A)ZBPE ZYSH B)2606301600 C)2608311559   E) A TEMPORARY PROHIBITED AREA ESTABLISHED BOUNDED BY:  N395600E1192100-N395600E1193300-N395100E1193900-N394300E1193900-N39  4300E1192100   BACK TO START.  VERTICAL LIMITS:GND-UNL.  ALL ACFT SHALL BE FORBIDDEN TO FLY INTO THE PROHIBITED AREA.  F)GND G)UNL,
FAA,34845039,C1167/2004,ZGZU,2004-11-07T20:52:00Z,,25.4,109.633333,005,QWMLW,"C1167/04 NOTAMN  Q) ZGZU/QWMLW/IV/BO/W/000/197/2524N10938E005  A) ZGZU B) 0411072052 C) 0412312359EST  E) 5816 1344 4905 0086 1562 3517 1410 ,PSN:  N252404E1093740. 1410 7559 6000M, 3517 1410 0584 1777 10KM.  F) GND  G) 6000M(AGL) .",
FAA,34845040,C1168/2004,ZGZU,2004-11-07T20:54:00Z,,25.283333,109.516667,005,QWMLW,"C1168/04 NOTAMN  Q) ZGZU/QWMLW/IV/BO/W/000/197/2517N10931E005  A) ZGZU B) 0411072054 C) 0412312359EST  E) 5816 1344 4905 0086 1562 3517 1410 ,PSN:  N251707E1093030. 1410 7559 6000M, 3517 1410 0584 1777 10KM.  F) GND  G) 6000M(AGL) .",
FAA,81499090,B2824/2026,RPHI,2026-06-21T00:00:00Z,2026-09-20T23:59:00Z,14.733333,121.15,005,QWELW,"B2824/26 NOTAMN  Q) RPHI/QWELW/IV/BO /W /000/020/1444N12109E005  A) RPHI B) 2606210000 C) 2609202359  E) MIL EXER WILL TAKE PLACE WI:  5NM RADIUS CENTERED ON 144357N 1210842E  (MONTALBAN, RIZAL).  F) SFC G) 2000FT AMSL",
FAA,81499124,B2825/2026,RPHI,2026-06-21T00:00:00Z,2026-09-20T23:59:00Z,10.033333,123.6,002,QWELW,"B2825/26 NOTAMN  Q) RPHI/QWELW/IV/BO /W /000/020/1002N12336E002  A) RPHI B) 2606210000 C) 2609202359  E) MIL EXER WILL TAKE PLACE WI:  1.5NM RADIUS CENTERED ON 100203N 1233542E  (SIBONGA, CEBU).  F) SFC G) 2000FT AMSL",
FAA,81499175,B2826/2026,RPHI,2026-06-21T00:00:00Z,2026-09-20T23:59:00Z,10.4,123.933333,003,QWELW,"B2826/26 NOTAMN  Q) RPHI/QWELW/IV/BO /W /000/020/1024N12356E003  A) RPHI B) 2606210000 C) 2609202359  E) MIL EXER WILL TAKE PLACE WI:  102507N 1235516E -  102551N 1235744E -  102345N 1235801E -  102206N 1235415E -  102507N 1235516E   (CONSOLACION-TALAMBAN, CEBU).  F) SFC G) 2000FT AMSL",
FAA,81499485,B2836/2026,RPHI,2026-06-21T00:00:00Z,2026-09-20T23:59:00Z,7.133333,122.15,005,QWELW,"B2836/26 NOTAMN  Q) RPHI/QWELW/IV/BO /W /000/020/0708N12209E005  A) RPHI B) 2606210000 C) 2609202359  E) MIL EXER WILL TAKE PLACE WI:  5NM RADIUS CENTERED ON 070807N 1220857E  (BUNGUIAO, ZAMBOANGA)  F) SFC G) 2000FT AMSL",
FAA,81262383,B2376/2026,RPHI,2026-06-30T22:00:00Z,2026-09-30T16:00:00Z,14.3,120.833333,008,QWELW,B2376/26 NOTAMN  Q) RPHI/QWELW/IV/BO /W /000/010/1418N12050E008  A) RPHI B) 2606302200 C) 2609301600  D) 2200-1600  E) MIL EXER WILL TAKE PLACE WI:  142305N 1205257E -  141804N 1205714E -  141104N 1204729E -  141710N 1204208E -  142305N 1205257E  (CAVITE AREA).  F) SFC G) 1000FT AMSL,
FAA,81533551,B2879/2026,RPHI,2026-06-30T22:00:00Z,2026-09-30T16:00:00Z,14.683333,120.5,005,QWELW,B2879/26 NOTAMN  Q) RPHI/QWELW/IV/BO /W /000/050/1441N12030E005  A) RPHI B) 2606302200 C) 2609301600  D) 2200-1600  E) MIL EXER WILL TAKE PLACE WI:  5NM RADIUS CENTERED ON 144100N 1203000E (BATAAN).  F) SFC G) 5000FT AMSL,
